{
  "$schema": "https://json-schema.org/draft/2020-12/schema",
  "$id": "campaign_factory.threadsdash_drafts.v2",
  "title": "Campaign Factory ThreadsDashboard Draft Payload v2",
  "type": "object",
  "additionalProperties": true,
  "required": [
    "schema",
    "campaign",
    "drafts"
  ],
  "properties": {
    "schema": {
      "const": "campaign_factory.threadsdash_drafts.v2"
    },
    "campaign": {
      "type": "string"
    },
    "userId": {
      "type": "string"
    },
    "handoffMode": {
      "type": "string",
      "enum": [
        "publishable_draft",
        "review_only"
      ]
    },
    "drafts": {
      "type": "array",
      "items": {
        "type": "object",
        "additionalProperties": true,
        "required": [
          "platform",
          "status",
          "distributionSurface",
          "instagramTrialReels",
          "trialGraduationStrategy",
          "shareToFeed",
          "collaborators",
          "metadata"
        ],
        "properties": {
          "platform": {
            "type": "string"
          },
          "status": {
            "type": "string"
          },
          "distributionSurface": {
            "type": "string",
            "enum": [
              "regular_reel",
              "trial_reel",
              "story",
              "story_cta",
              "feed_single",
              "feed_carousel"
            ]
          },
          "instagramTrialReels": {
            "type": "boolean"
          },
          "trialGraduationStrategy": {
            "enum": [
              null,
              "MANUAL",
              "SS_PERFORMANCE"
            ]
          },
          "shareToFeed": {
            "type": "boolean"
          },
          "collaborators": {
            "type": "array",
            "maxItems": 0
          },
          "metadata": {
            "type": "object",
            "required": [
              "campaign_factory"
            ],
            "properties": {
              "campaign_factory": {
                "type": "object",
                "required": [
                  "asset_state",
                  "approved",
                  "captioned_render_present",
                  "visible_caption_verification",
                  "expected_visual_verification",
                  "content_fingerprint",
                  "generated_asset_lineage",
                  "captionOutcomeContext",
                  "audio_intent",
                  "handoff_manifest",
                  "readiness_checks_pass",
                  "visualQcStatus",
                  "identityVerificationStatus"
                ],
                "properties": {
                  "asset_state": {
                    "type": "string",
                    "enum": [
                      "approved_but_not_publishable",
                      "publishable_candidate",
                      "exportable",
                      "review_ready"
                    ]
                  },
                  "handoffMode": {
                    "type": "string",
                    "enum": [
                      "publishable_draft",
                      "review_only"
                    ]
                  },
                  "scheduleSafe": {
                    "type": "boolean"
                  },
                  "allowPublish": {
                    "type": "boolean"
                  },
                  "approvalRequired": {
                    "type": "boolean"
                  },
                  "approved": {
                    "type": "boolean"
                  },
                  "captioned_render_present": {
                    "type": "boolean"
                  },
                  "visible_caption_verification": {
                    "type": "string",
                    "enum": [
                      "pass",
                      "fail"
                    ]
                  },
                  "expected_visual_verification": {
                    "type": "string",
                    "enum": [
                      "pass",
                      "fail"
                    ]
                  },
                  "content_fingerprint": {
                    "type": "string"
                  },
                  "publishability_failure_reasons": {
                    "type": "array",
                    "items": {
                      "type": "string",
                      "enum": [
                        "missing_burned_captions",
                        "wrong_visual",
                        "missing_caption_hash",
                        "missing_caption_outcome_context",
                        "missing_content_fingerprint",
                        "missing_audio",
                        "embedded_audio_missing",
                        "readiness_failed",
                        "not_approved",
                        "caption_placement_qc_failed",
                        "missing_instagram_post_caption",
                        "instagram_post_caption_quality_failed",
                        "visual_qc_unavailable",
                        "visual_qc_failed",
                        "identity_verification_unavailable",
                        "identity_verification_failed",
                        "creative_approval_missing",
                        "missing_audit",
                        "product_mode_lineage_unclassified",
                        "exact_final_sha_unverified",
                        "exact_final_audit_unverified",
                        "recreate_permission_not_granted",
                        "embedded_audio_unverified",
                        "audio_final_sha_unbound",
                        "audio_rights_evidence_unverified",
                        "timed_caption_semantic_approval_unverified",
                        "static_caption_lineage_unverified",
                        "caption_variant_lineage_unclassified",
                        "caption_placement_approval_unverified",
                        "caption_repeated_in_inventory"
                      ]
                    }
                  },
                  "blockingReason": {
                    "type": [
                      "string",
                      "null"
                    ]
                  },
                  "rootCause": {
                    "type": [
                      "string",
                      "null"
                    ]
                  },
                  "handoff_manifest": {
                    "type": [
                      "object",
                      "null"
                    ],
                    "required": [
                      "manifest_version",
                      "asset_id",
                      "render_file_id",
                      "content_fingerprint",
                      "caption_hash",
                      "captionOutcomeContext",
                      "visual_verification_id",
                      "caption_verification_id",
                      "audio_id",
                      "distribution_plan_id",
                      "exported_by_system",
                      "exported_at"
                    ],
                    "properties": {
                      "manifest_version": {
                        "enum": [
                          1,
                          2
                        ]
                      },
                      "asset_id": {
                        "type": "string"
                      },
                      "render_file_id": {
                        "type": "string"
                      },
                      "content_fingerprint": {
                        "type": "string"
                      },
                      "caption_hash": {
                        "type": "string"
                      },
                      "captionOutcomeContext": {
                        "$ref": "caption_outcome_context.v1.schema.json"
                      },
                      "visual_verification_id": {
                        "type": "string"
                      },
                      "caption_verification_id": {
                        "type": "string"
                      },
                      "audio_id": {
                        "type": "string"
                      },
                      "distribution_plan_id": {
                        "type": "string"
                      },
                      "exported_by_system": {
                        "const": "campaign_factory"
                      },
                      "exported_at": {
                        "type": "string"
                      },
                      "concept_id": {
                        "type": "string"
                      },
                      "parent_asset_id": {
                        "type": "string"
                      },
                      "parent_reel_id": {
                        "type": "string"
                      },
                      "variant_family_id": {
                        "type": "string"
                      },
                      "variant_id": {
                        "type": "string"
                      },
                      "variant_index": {
                        "type": "integer"
                      },
                      "variant_operations": {
                        "type": "array"
                      },
                      "visualQcStatus": {
                        "type": "string",
                        "enum": [
                          "passed",
                          "failed",
                          "unavailable"
                        ]
                      },
                      "identityVerificationStatus": {
                        "type": "string",
                        "enum": [
                          "passed",
                          "failed",
                          "unavailable"
                        ]
                      },
                      "visualQc": {
                        "type": "object",
                        "additionalProperties": true
                      },
                      "identityVerification": {
                        "type": "object",
                        "additionalProperties": true
                      }
                    },
                    "additionalProperties": true
                  },
                  "concept_id": {
                    "type": [
                      "string",
                      "null"
                    ]
                  },
                  "parent_asset_id": {
                    "type": [
                      "string",
                      "null"
                    ]
                  },
                  "parent_reel_id": {
                    "type": [
                      "string",
                      "null"
                    ]
                  },
                  "variant_family_id": {
                    "type": [
                      "string",
                      "null"
                    ]
                  },
                  "variant_id": {
                    "type": [
                      "string",
                      "null"
                    ]
                  },
                  "variant_index": {
                    "type": [
                      "integer",
                      "null"
                    ]
                  },
                  "variant_operations": {
                    "type": [
                      "array",
                      "null"
                    ]
                  },
                  "readiness_checks_pass": {
                    "type": "boolean"
                  },
                  "graph_id": {
                    "type": [
                      "string",
                      "null"
                    ]
                  },
                  "campaign_graph_id": {
                    "type": [
                      "string",
                      "null"
                    ]
                  },
                  "source_asset_graph_id": {
                    "type": [
                      "string",
                      "null"
                    ]
                  },
                  "rendered_asset_graph_id": {
                    "type": [
                      "string",
                      "null"
                    ]
                  },
                  "audit_graph_id": {
                    "type": [
                      "string",
                      "null"
                    ]
                  },
                  "captionOutcomeContext": {
                    "$ref": "caption_outcome_context.v1.schema.json"
                  },
                  "caption_outcome_context": {
                    "$ref": "caption_outcome_context.v1.schema.json"
                  },
                  "generated_asset_lineage": {
                    "oneOf": [
                      { "$ref": "generated_asset_lineage.v2.schema.json" },
                      { "$ref": "owned_library_lineage.v1.schema.json" }
                    ]
                  },
                  "learning_cohort": {
                    "$ref": "learning_cohort.v1.schema.json"
                  },
                  "audio_intent": {
                    "$ref": "audio_intent.v1.schema.json"
                  },
                  "visualQcStatus": {
                    "type": "string",
                    "enum": [
                      "passed",
                      "failed",
                      "unavailable"
                    ]
                  },
                  "identityVerificationStatus": {
                    "type": "string",
                    "enum": [
                      "passed",
                      "failed",
                      "unavailable"
                    ]
                  }
                },
                "additionalProperties": true
              }
            },
            "additionalProperties": true
          }
        },
        "allOf": [
          {
            "if": {
              "required": [
                "distributionSurface"
              ],
              "properties": {
                "distributionSurface": {
                  "const": "trial_reel"
                }
              }
            },
            "then": {
              "properties": {
                "instagramTrialReels": {
                  "const": true
                },
                "trialGraduationStrategy": {
                  "enum": [
                    "MANUAL",
                    "SS_PERFORMANCE"
                  ]
                },
                "shareToFeed": {
                  "const": false
                }
              }
            }
          },
          {
            "if": {
              "required": [
                "instagramTrialReels"
              ],
              "properties": {
                "instagramTrialReels": {
                  "const": true
                }
              }
            },
            "then": {
              "properties": {
                "distributionSurface": {
                  "const": "trial_reel"
                },
                "shareToFeed": {
                  "const": false
                }
              }
            }
          },
          {
            "if": {
              "required": [
                "instagramTrialReels"
              ],
              "properties": {
                "instagramTrialReels": {
                  "const": false
                }
              }
            },
            "then": {
              "properties": {
                "trialGraduationStrategy": {
                  "const": null
                }
              }
            }
          },
          {
            "if": {
              "required": [
                "distributionSurface"
              ],
              "properties": {
                "distributionSurface": {
                  "const": "regular_reel"
                }
              }
            },
            "then": {
              "properties": {
                "instagramTrialReels": {
                  "const": false
                },
                "shareToFeed": {
                  "const": true
                }
              }
            }
          }
        ]
      }
    },
    "pipelineTraceId": {
      "type": [
        "string",
        "null"
      ],
      "description": "Shared trace ID propagated through the pipeline for end-to-end observability"
    }
  }
}
