{
  "schema": "campaign_factory.threadsdash_drafts.v2",
  "campaign": "audio_smoke",
  "drafts": [
    {
      "platform": "instagram",
      "status": "draft",
      "distributionSurface": "regular_reel",
      "instagramTrialReels": false,
      "trialGraduationStrategy": null,
      "shareToFeed": true,
      "collaborators": [],
      "metadata": {
        "campaign_factory": {
          "graph_id": "cg_rendered_asset_assetsmoke01",
          "campaign_graph_id": "cg_campaign_campsmoke001",
          "source_asset_graph_id": "cg_source_asset_sourcesmoke1",
          "rendered_asset_graph_id": "cg_rendered_asset_assetsmoke01",
          "audit_graph_id": "cg_audit_report_auditsmoke01",
          "campaign_id": "camp_smoke",
          "rendered_asset_id": "asset_smoke",
          "asset_state": "publishable_candidate",
          "approved": true,
          "captioned_render_present": true,
          "visible_caption_verification": "pass",
          "expected_visual_verification": "pass",
          "content_fingerprint": "content_fp_rendered_asset_smoke",
          "caption_hash": "caption_hash_rendered",
          "instagram_post_caption": "lmk #fyp",
          "instagram_post_caption_hash": "instagram_post_caption_hash_rendered",
          "readiness_checks_pass": true,
          "handoff_manifest": {
            "manifest_version": 1,
            "asset_id": "asset_smoke",
            "render_file_id": "render_file_smoke",
            "content_fingerprint": "content_fp_rendered_asset_smoke",
            "caption_hash": "caption_hash_rendered",
            "instagram_post_caption": "lmk #fyp",
            "instagram_post_caption_hash": "instagram_post_caption_hash_rendered",
            "captionOutcomeContext": {
              "schema": "campaign_factory.caption_outcome_context.v1",
              "caption_hash": "caption_hash_rendered",
              "caption_text": "Hard launch energy.",
              "caption_bank": "launch_hooks"
            },
            "visual_verification_id": "visual_verify_smoke",
            "caption_verification_id": "caption_verify_smoke",
            "audio_id": "ig_runway_pop",
            "distribution_plan_id": "dist_smoke",
            "exported_by_system": "campaign_factory",
            "exported_at": "2026-06-04T12:05:00Z",
            "visualQcStatus": "passed",
            "identityVerificationStatus": "passed",
            "visualQc": {
              "visualQcStatus": "passed",
              "status": "passed"
            },
            "identityVerification": {
              "schema": "reel_factory.identity_verification.v1",
              "status": "passed",
              "score": 0.91
            }
          },
          "captionOutcomeContext": {
            "schema": "campaign_factory.caption_outcome_context.v1",
            "caption_hash": "caption_hash_rendered",
            "caption_text": "Hard launch energy.",
            "caption_bank": "launch_hooks",
            "caption_banks": [
              "launch_hooks"
            ],
            "creator_mix": "Lola",
            "creator_model": "lola_v1",
            "frame_type": "mirror_selfie",
            "length_class": "short",
            "format_class": "reel",
            "caption_fit_version": "v1",
            "suitability_decision": "allowed",
            "suitability_reason": "frame_match",
            "render_recipe": "reel_factory.preview.v1",
            "source_clip": "/tmp/source.mp4",
            "rendered_output": "/tmp/rendered.mp4"
          },
          "caption_outcome_context": {
            "schema": "campaign_factory.caption_outcome_context.v1",
            "caption_hash": "caption_hash_rendered",
            "caption_text": "Hard launch energy.",
            "caption_bank": "launch_hooks",
            "caption_banks": [
              "launch_hooks"
            ],
            "creator_mix": "Lola",
            "creator_model": "lola_v1",
            "frame_type": "mirror_selfie",
            "length_class": "short",
            "format_class": "reel",
            "caption_fit_version": "v1",
            "suitability_decision": "allowed",
            "suitability_reason": "frame_match",
            "render_recipe": "reel_factory.preview.v1",
            "source_clip": "/tmp/source.mp4",
            "rendered_output": "/tmp/rendered.mp4"
          },
          "generated_asset_lineage": {
            "schema": "reel_factory.generated_asset_lineage.v2",
            "pipelineTraceId": "trace_generated_asset_002",
            "campaignId": "camp_smoke",
            "recipeId": "v01_original",
            "captionHash": "caption_hash_rendered",
            "renderedAssetId": "asset_smoke",
            "contentFingerprint": "0123456789abcdef0123456789abcdef0123456789abcdef0123456789abcdef",
            "variationApplied": false,
            "variantId": null,
            "audioIntentFingerprint": "0123456789abcdef0123456789abcdef0123456789abcdef0123456789abcdef",
            "audioId": null,
            "source": {
              "referenceId": "ref_001",
              "promptId": "prompt_001",
              "patternCardId": "pattern_mirror_001",
              "formatType": "mirror_selfie"
            },
            "generation": {
              "tool": "higgsfield_kling_manual",
              "modelProfile": "soul_id_primary",
              "assetPath": "/tmp/generated.mp4"
            },
            "review": {
              "humanReviewRequired": true,
              "status": "approved"
            },
            "quality": {
              "readiness_checks_pass": true
            },
            "asset_state": "exportable"
          },
          "audio_intent": {
            "schema": "pipeline.audio_intent.v1",
            "policy": "native_trending_required",
            "mode": "native_platform_audio",
            "required": true,
            "status": "selected",
            "platform": "instagram",
            "surface": "regular_reel",
            "recommendations": [
              {
                "audio_title": "Runway Pop",
                "artist_name": "DJ A",
                "platform_audio_id": "ig_runway_pop",
                "platform_url": "https://instagram.com/audio/runway_pop",
                "freshness": "rising",
                "confidence": 0.9,
                "vibe_tags": [
                  "glam",
                  "fit_check"
                ],
                "rationale": "trend:rising, tag_match:fit_check",
                "instruction": "Attach native instagram audio: Runway Pop"
              }
            ],
            "operator_selection": {
              "audio_title": "Runway Pop",
              "artist_name": "DJ A",
              "platform_audio_id": "ig_runway_pop",
              "platform_url": "https://instagram.com/audio/runway_pop",
              "selected_at": "2026-06-04T12:00:00Z",
              "selection_source": "publishable_candidate_gate"
            },
            "gates": {
              "allow_draft_export": true,
              "allow_preview_schedule": false,
              "allow_live_schedule": false,
              "allow_publish": false
            }
          },
          "visualQcStatus": "passed",
          "identityVerificationStatus": "passed"
        }
      }
    }
  ],
  "pipelineTraceId": null
}
